"Name","Gene.s.","Protein.change","Condition.s.","Clinical.significance..Last.reviewed.","Review.status","Accession","GRCh37Chromosome","GRCh37Location","GRCh38Chromosome","GRCh38Location","VariationID","AlleleID.s.","dbSNP.ID","Canonical.SPDI"
"NM_001110556.2(FLNA):c.620C>T (p.Pro207Leu)","FLNA","P207L","not specified|Oto-palato-digital syndrome, type I|Cleft palate|Conductive hearing impairment|Short stature","Pathogenic(Last reviewed: Nov 20, 2018)","criteria provided, multiple submitters, no conflicts","VCV000011755","X","153596212","X","154367844",11755,"26794","rs28935469","NC_000023.11:154367843:G:A"
"NM_001110556.2(FLNA):c.3596C>T (p.Ser1199Leu)","FLNA","S1199L","Oto-palato-digital syndrome, type II|Melnick-Needles syndrome|Melnick-Needles syndrome|Frontometaphyseal dysplasia|Periventricular nodular heterotopia 1|Oto-palato-digital syndrome, type II","Pathogenic(Last reviewed: Dec 23, 2016)","criteria provided, multiple submitters, no conflicts","VCV000011759","X","153588567","X","154360199",11759,"26798","rs28935473","NC_000023.11:154360198:G:A"
"NM_001110792.2(MECP2):c.509C>T (p.Thr170Met)","MECP2","T158M, T170M, T65M","History of neurodevelopmental disorder|Angelman syndrome|Inborn genetic diseases|Severe neonatal-onset encephalopathy with microcephaly|Syndromic X-linked intellectual disability Lubs type|Autism, susceptibility to, X-linked 3|Rett syndrome|Mental retardation, X-linked, syndromic 13|Severe neonatal-onset encephalopathy with microcephaly|Rett syndrome|not provided|not specified|Autism, susceptibility to, X-linked 3","Pathogenic/Likely pathogenic(Last reviewed: Oct 23, 2020)","criteria provided, multiple submitters, no conflicts","VCV000011811","X","153296806","X","154031355",11811,"26850","rs28934906","NC_000023.11:154031354:G:A"
"NM_001110792.2(MECP2):c.352C>T (p.Arg118Trp)","MECP2","R106W, R118W, R13W","not provided|Autism, susceptibility to, X-linked 3|Rett syndrome|Severe neonatal-onset encephalopathy with microcephaly|History of neurodevelopmental disorder|not specified","Pathogenic/Likely pathogenic(Last reviewed: Jul 14, 2020)","criteria provided, multiple submitters, no conflicts","VCV000011814","X","153297719","X","154032268",11814,"26853","rs28934907","NC_000023.11:154032267:G:A"
"NM_000533.5(PLP1):c.44C>T (p.Pro15Leu)","PLP1|RAB9B","P15L","Pelizaeus-Merzbacher disease","Pathogenic(Last reviewed: Dec 1, 1989)","no assertion criteria provided","VCV000011075","X","103040550","X","103785621",11075,"26114","rs11543022","NC_000023.11:103785620:C:T"
"NM_139058.3(ARX):c.98T>C (p.Leu33Pro)","ARX","L33P","Mental retardation, with or without seizures, ARX-related, X-linked","Pathogenic(Last reviewed: Apr 15, 2002)","no assertion criteria provided","VCV000011198","X","25033757","X","25015640",11198,"26237","rs28936077","NC_000023.11:25015639:A:G"
"NM_000033.4(ABCD1):c.1850G>A (p.Arg617His)","ABCD1","R617H","not provided|none provided|Adrenoleukodystrophy","Pathogenic(Last reviewed: Oct 9, 2020)","criteria provided, multiple submitters, no conflicts","VCV000011312","X","153008510","X","153743056",11312,"26351","rs11146842","NC_000023.11:153743055:G:A"
"NM_000033.4(ABCD1):c.1849C>T (p.Arg617Cys)","ABCD1","R617C","Adrenoleukodystrophy|none provided|not provided","Pathogenic/Likely pathogenic(Last reviewed: Jan 22, 2021)","criteria provided, multiple submitters, no conflicts","VCV000011313","X","153008509","X","153743055",11313,"26352","rs4010613","NC_000023.11:153743054:C:T"
"NM_000061.2(BTK):c.370T>C (p.Trp124Arg)","BTK","W124R, W158R","not provided","Likely pathogenic(Last reviewed: Nov 11, 2015)","criteria provided, single submitter","VCV000381633","X","100625007","X","101370019",381633,"378793","rs7474275","NC_000023.11:101370018:A:G"
"NM_014009.4(FOXP3):c.155G>T (p.Gly52Val)","FOXP3","G52V","Non-obstructive azoospermia|Insulin-dependent diabetes mellitus secretory diarrhea syndrome","Benign(Last reviewed: Nov 23, 2020)","criteria provided, single submitter","VCV000712945","X","49114808","X","49258351",712945,"729636","rs17847095","NC_000023.11:49258350:C:A"
"NM_001110792.2(MECP2):c.352C>G (p.Arg118Gly)","MECP2","R106G, R118G, R13G","Rett syndrome","Uncertain significance(Last reviewed: Jan 21, 2008)","no assertion criteria provided","VCV000143533","X","153297719","X","154032268",143533,"153265","rs28934907","NC_000023.11:154032267:G:C"
"NM_001323289.2(CDKL5):c.2494C>T (p.Gln832Ter)","CDKL5","Q832*","Early infantile epileptic encephalopathy 2","Pathogenic(Last reviewed: Mar 13, 2014)","no assertion criteria provided","VCV000189573","X","18643365","X","18625245",189573,"187625","rs17857094","NC_000023.11:18625244:C:T"
