"Name","Gene.s.","Protein.change","Condition.s.","Clinical.significance..Last.reviewed.","Review.status","Accession","GRCh37Chromosome","GRCh37Location","GRCh38Chromosome","GRCh38Location","VariationID","AlleleID.s.","dbSNP.ID","Canonical.SPDI"
"0","0","0","0","0","0","0","0","0","0","0",0,"0","0","0"
"NM_002506.2(NGF):c.661C>T (p.Arg221Trp)","NGF|NGF-AS1","R211W, R221W","Congenital sensory neuropathy with selective loss of small myelinated fibers","Pathogenic(Last reviewed: Feb 1, 2011)","no assertion criteria provided","VCV000014045","1","115828756","1","115286135",14045,"29084","rs11466112","NC_000001.11:115286134:G:A"
"NM_170707.4(LMNA):c.1445G>A (p.Arg482Gln)","LMNA","R482Q, R370Q, R401Q","Hutchinson-Gilford syndrome|Heart-hand syndrome, Slovenian type|Mandibuloacral dysplasia with type A lipodystrophy|Charcot-Marie-Tooth disease type 2B1|Dilated cardiomyopathy 1A|Emery-Dreifuss muscular dystrophy 3, autosomal recessive|Congenital muscular dystrophy, LMNA-related|Familial partial lipodystrophy 2|Lethal tight skin contracture syndrome|Emery-Dreifuss muscular dystrophy 2, autosomal dominant|Dilated cardiomyopathy-hypergonadotropic hypogonadism syndrome|Laminopathy|Monogenic diabetes|not provided|Cardiomyopathy|Emery-Dreifuss muscular dystrophy 3, autosomal recessive|Charcot-Marie-Tooth disease, type 2|Familial partial lipodystrophy 2","Conflicting interpretations of pathogenicity(Last reviewed: Aug 21, 2020)","criteria provided, conflicting interpretations","VCV000014486","1","156106776","1","156136985",14486,"29525","rs11575937","NC_000001.11:156136984:G:A"
"NM_170707.4(LMNA):c.1445G>T (p.Arg482Leu)","LMNA","R482L, R370L, R401L","Lethal tight skin contracture syndrome|Emery-Dreifuss muscular dystrophy|Emery-Dreifuss muscular dystrophy 2, autosomal dominant|Congenital muscular dystrophy, LMNA-related|Hutchinson-Gilford syndrome|Charcot-Marie-Tooth disease type 2B1|Mandibuloacral dysplasia with type A lipodystrophy|Familial partial lipodystrophy 2|Dilated cardiomyopathy 1A|not provided|Lipoatrophy with Diabetes, Hepatic Steatosis, Hypertrophic Cardiomyopathy, and Leukomelanodermic Papules","Uncertain significance(Last reviewed: Jan 9, 2019)","criteria provided, single submitter","VCV000014490","1","156106776","1","156136985",14490,"29529","rs11575937","NC_000001.11:156136984:G:T"
"NM_000702.4(ATP1A2):c.2291T>C (p.Leu764Pro)","ATP1A2","L764P","Familial hemiplegic migraine|Familial hemiplegic migraine type 2","Pathogenic(Last reviewed: Apr 22, 2021)","no assertion criteria provided","VCV000012917","1","160105635","1","160135845",12917,"27956","rs28933398","NC_000001.11:160135844:T:C"
"NM_000702.4(ATP1A2):c.2192T>C (p.Met731Thr)","ATP1A2","M731T","Familial hemiplegic migraine type 2","Pathogenic(Last reviewed: Jan 13, 2012)","no assertion criteria provided","VCV000012919","1","160105300","1","160135510",12919,"27958","rs28933400","NC_000001.11:160135509:T:C"
"NM_001007792.1(NTRK1):c.1702C>T (p.His568Tyr)","NTRK1","H598Y, H568Y, H604Y","not specified|not provided|Hereditary insensitivity to pain with anhidrosis|Familial medullary thyroid carcinoma","Benign/Likely benign(Last reviewed: Jul 1, 2021)","criteria provided, multiple submitters, no conflicts","VCV000037077","1","156848918","1","156879126",37077,"38397","rs6336","NC_000001.11:156879125:C:T"
"NM_000157.4(GBA):c.680A>G (p.Asn227Ser)","GBA|LOC106627981","N227S, N140S, N178S","Gaucher disease type 3C|Gaucher disease type III|Gaucher disease type I|Gaucher disease type II|not provided|Gaucher disease|Gaucher disease type I|Gaucher disease type III","Pathogenic/Likely pathogenic(Last reviewed: Jul 26, 2020)","criteria provided, multiple submitters, no conflicts","VCV000004314","1","155208006","1","155238215",4314,"19353","rs364897","NC_000001.11:155238214:T:C"
"NM_000157.3(GBA):c.1448T>C","GBA|LOC106627981","L483P, L396P, L434P","not provided|Gaucher disease type 3C|Gaucher disease type III|Gaucher disease type I|Gaucher disease type II|Parkinson disease, late-onset|Gaucher disease|Dementia, Lewy body, susceptibility to|Hereditary late onset Parkinson disease|Gaucher disease, perinatal lethal|Gaucher disease type I|Gaucher disease type II|Gaucher disease type III|Thoracolumbar scoliosis|Resting tremor|Parkinsonism|Hypomimic face|Movement disorder","Pathogenic, risk factor(Last reviewed: Jun 1, 2021)","criteria provided, multiple submitters, no conflicts","VCV000004288","1","155205043","1","155235252",4288,"19327","rs421016","NC_000001.11:155235251:A:G"
"NM_000157.4(GBA):c.259C>T (p.Arg87Trp)","GBA|LOC106627981","R87W","Gaucher disease|Gaucher disease type I|not provided","Pathogenic(Last reviewed: Feb 13, 2020)","criteria provided, multiple submitters, no conflicts","VCV000004321","1","155209725","1","155239934",4321,"19360","rs1141814","NC_000001.11:155239933:G:A"
"NM_000130.4(F5):c.1601G>A (p.Arg534Gln)","F5","","not specified|Thrombophilia due to factor V Leiden|Factor V deficiency|Ischemic stroke, susceptibility to|Budd-Chiari syndrome, susceptibility to|Pregnancy loss, recurrent, susceptibility to, 1|Thrombophilia due to factor V Leiden|Factor V deficiency","Pathogenic, risk factor(Last reviewed: Feb 22, 2021)","criteria provided, multiple submitters, no conflicts","VCV000000642","1","169519049","1","169549811",642,"15681","rs6025","NC_000001.11:169549810:C:T"
"NM_001008216.2(GALE):c.937C>A (p.Leu313Met)","GALE","L313M","UDPglucose-4-epimerase deficiency","Pathogenic(Last reviewed: Jan 1, 1998)","no assertion criteria provided","VCV000003680","1","24122692","1","23796202",3680,"18719","rs3180383","NC_000001.11:23796201:G:T"
"NM_005263.5(GFI1):c.1208A>G (p.Lys403Arg)","GFI1","K403R","Neutropenia, nonimmune chronic idiopathic, of adults|Severe congenital neutropenia 2, autosomal dominant","Likely benign(Last reviewed: May 28, 2019)","criteria provided, single submitter","VCV000008740","1","92941647","1","92476090",8740,"23779","rs28936382","NC_000001.11:92476089:T:C"
"NM_000098.3(CPT2):c.1883A>C (p.Tyr628Ser)","CPT2","Y628S, Y605S","Carnitine palmitoyltransferase II deficiency|Carnitine palmitoyltransferase II deficiency, myopathic, stress-induced|Carnitine palmitoyltransferase II deficiency, infantile","Pathogenic/Likely pathogenic(Last reviewed: May 28, 2019)","criteria provided, multiple submitters, no conflicts","VCV000008956","1","53679173","1","53213501",8956,"23995","rs28936673","NC_000001.11:53213500:A:C"
"NM_000098.3(CPT2):c.520G>A (p.Glu174Lys)","CPT2","E174K","Carnitine palmitoyltransferase II deficiency|Carnitine palmitoyltransferase II deficiency, infantile","Pathogenic/Likely pathogenic(Last reviewed: Oct 19, 2020)","criteria provided, multiple submitters, no conflicts","VCV000008957","1","53675866","1","53210194",8957,"23996","rs28936674","NC_000001.11:53210193:G:A"
"NM_000642.3(AGL):c.4459C>T (p.Arg1487Ter)","AGL","R1487*, R1471*","Glycogen storage disease type III|Glycogen storage disease","Conflicting interpretations of pathogenicity(Last reviewed: Oct 1, 2020)","criteria provided, conflicting interpretations","VCV000456508","1","100382265","1","99916709",456508,"448519","rs12118058","NC_000001.11:99916708:C:T"
"NM_002016.1(FLG):c.3551C>A (p.Ser1184Ter)","FLG","S1184*","not provided","Pathogenic(Last reviewed: Jul 15, 2015)","criteria provided, single submitter","VCV000419209","1","152283811","1","152311335",419209,"404917","rs3120649","NC_000001.11:152311334:G:T"
"NM_018116.3(MSTO1):c.971C>T (p.Thr324Ile)","MSTO1","T324I, T146I, T147I, T143I, T269I","Mitochondrial myopathy-cerebellar ataxia-pigmentary retinopathy syndrome|Inborn genetic diseases","Conflicting interpretations of pathogenicity(Last reviewed: Apr 23, 2021)","criteria provided, conflicting interpretations","VCV000438833","1","155582639","1","155612848",438833,"432466","rs622288","NC_000001.11:155612847:C:T"
"NM_000098.3(CPT2):c.520G>T (p.Glu174Ter)","CPT2","E174*","Carnitine palmitoyltransferase II deficiency, infantile","Likely pathogenic(Last reviewed: Jan 26, 2017)","criteria provided, single submitter","VCV000550520","1","53675866","1","53210194",550520,"541317","rs28936674","NC_000001.11:53210193:G:T"
"NM_006516.3(SLC2A1):c.1372C>A (p.Arg458=)","SLC2A1","","History of neurodevelopmental disorder|GLUT1 deficiency syndrome 1|GLUT1 deficiency syndrome 1, autosomal recessive|not specified|Dystonia 9","Benign(Last reviewed: Dec 4, 2020)","criteria provided, multiple submitters, no conflicts","VCV000139167","1","43392819","1","42927148",139167,"142870","rs13306758","NC_000001.11:42927147:G:T"
"NM_000157.4(GBA):c.475C>T (p.Arg159Trp)","GBA|LOC106627981","R159W, R110W, R72W","Gaucher disease|not provided","Pathogenic(Last reviewed: Dec 3, 2019)","criteria provided, multiple submitters, no conflicts","VCV000065570","1","155208421","1","155238630",65570,"76478","rs439898","NC_000001.11:155238629:G:A"
"NM_006516.3(SLC2A1):c.1372C>T (p.Arg458Trp)","SLC2A1","R458W","Dystonia 9|GLUT1 deficiency syndrome 2|Epilepsy, idiopathic generalized, susceptibility to, 12|Stomatin-deficient cryohydrocytosis with neurologic defects|GLUT1 deficiency syndrome 1|not provided|Epilepsy, idiopathic generalized, susceptibility to, 12|GLUT1 deficiency syndrome 1, autosomal recessive","Pathogenic/Likely pathogenic(Last reviewed: Nov 9, 2018)","criteria provided, multiple submitters, no conflicts","VCV000096708","1","43392819","1","42927148",96708,"102597","rs13306758","NC_000001.11:42927147:G:A"
"NM_000350.3(ABCA4):c.4685T>C (p.Ile1562Thr)","ABCA4","I1562T","Stargardt disease|Cone-rod dystrophy 3|Retinal dystrophy|not provided|Cone-Rod Dystrophy, Recessive|Retinitis Pigmentosa, Recessive|Cone-rod dystrophy|ABCA4-Related Disorders|Stargardt disease 1","Conflicting interpretations of pathogenicity(Last reviewed: Oct 8, 2020)","criteria provided, conflicting interpretations","VCV000099311","1","94487490","1","94021934",99311,"105200","rs1762111","NC_000001.11:94021933:A:G"
"NM_000157.4(GBA):c.1448T>G (p.Leu483Arg)","GBA|LOC106627981","L483R, L434R, L396R","not provided|Gaucher disease type II|Gaucher disease type III|Gaucher disease type I|Gaucher disease type II|Gaucher disease type 3C|Gaucher disease type I|Gaucher disease","Pathogenic/Likely pathogenic(Last reviewed: Aug 14, 2020)","criteria provided, multiple submitters, no conflicts","VCV000093449","1","155205043","1","155235252",93449,"99356","rs421016","NC_000001.11:155235251:A:C"
"NM_000157.4(GBA):c.681T>G (p.Asn227Lys)","GBA|LOC106627981","N227K, N140K, N178K","Gaucher disease type II|Gaucher disease type I|Gaucher disease type 3C|Gaucher disease type III|not provided|Gaucher disease","Pathogenic(Last reviewed: May 26, 2017)","criteria provided, multiple submitters, no conflicts","VCV000093458","1","155208005","1","155238214",93458,"99363","rs381418","NC_000001.11:155238213:A:C"
"NM_000350.3(ABCA4):c.3377T>C (p.Leu1126Pro)","ABCA4","L1126P","Stargardt disease 1","Likely pathogenic(Last reviewed: Jan 1, 2016)","criteria provided, single submitter","VCV000236101","1","94506910","1","94041354",236101,"237679","rs1047376","NC_000001.11:94041353:A:G"
"NM_000130.5(F5):c.1601= (p.Arg534=)","F5","","Factor V deficiency|not provided|hormonal contraceptives for systemic use response - Toxicity/ADR","drug response(Last reviewed: Nov 28, 2017)","reviewed by expert panel","VCV000226007","1","169519049","1","169549811",226007,"227743","rs6025","NC_000001.11:169549810:C:C"
"NM_001083116.3(PRF1):c.673C>T (p.Arg225Trp)","PRF1","R225W","Familial hemophagocytic lymphohistiocytosis 2","Pathogenic(Last reviewed: Apr 27, 2017)","criteria provided, single submitter","VCV000013711","10","72358804","10","70599048",13711,"28750","rs28933973","NC_000010.11:70599047:G:A"
"CYP2C19*4A/*11","CYP2C19","R150H","Citalopram response|Voriconazole response|Sertraline response|Escitalopram response","drug response","practice guideline","VCV000634361","10","96535264","10","94775507",634361,"622288","rs58973490","NC_000010.11:94775506:G:A"
"CYP2C19*4A/*35","CYP2C19","","Voriconazole response|Escitalopram response|Citalopram response|Sertraline response","drug response","practice guideline","VCV000634019","10","96535124","10","94775367",634019,"622287","rs12769205","NC_000010.11:94775366:A:G"
"CYP2C19*4A/*14","CYP2C19","L17P","Citalopram response|Escitalopram response|Voriconazole response|Sertraline response","drug response","practice guideline","VCV000634159","10","96522512","10","94762755",634159,"622280","rs55752064","NC_000010.11:94762754:T:C"
"CYP2C19*4A/*32","CYP2C19","H99R","Escitalopram response|Sertraline response|Voriconazole response|Citalopram response","drug response","practice guideline","VCV000634162","10","96534942","10","94775185",634162,"622286","rs1288601658","NC_000010.11:94775184:A:G"
"CYP2C19*4A/*10","CYP2C19","P227L","Voriconazole response|Sertraline response|Escitalopram response|Citalopram response","drug response","practice guideline","VCV000633981","10","96541615","10","94781858",633981,"47951","rs6413438","NC_000010.11:94781857:C:T"
"CYP2C19*4A/*16","CYP2C19","R442C","Voriconazole response|Escitalopram response|Citalopram response|Sertraline response","drug response","practice guideline","VCV000633982","10","96612522","10","94852765",633982,"622295","rs192154563","NC_000010.11:94852764:C:T"
"NM_000518.4(HBB):c.20A>C (p.Glu7Ala)","LOC106099062|LOC107133510|HBB","E7A","HEMOGLOBIN G (MAKASSAR)","other(Last reviewed: Dec 12, 2017)","no assertion criteria provided","VCV000015175","11","5248232","11","5227002",15175,"30214","rs334","NC_000011.10:5227001:T:G"
"NM_000518.5(HBB):c.20A>T (p.Glu7Val)","HBB|LOC106099062|LOC107133510","E7V","HEMOGLOBIN S|Hemoglobin E|Fetal hemoglobin quantitative trait locus 1|not provided|none provided|Anemia|Hb SS disease|Sickle cell disease and related diseases|Malaria, resistance to|Fetal hemoglobin quantitative trait locus 1|Hb SS disease|Erythrocytosis 6, familial|Methemoglobinemia, beta-globin type|Susceptibility to malaria|alpha Thalassemia|Heinz body anemia|Beta-thalassemia, dominant inclusion body type|beta Thalassemia|beta Thalassemia|Inborn genetic diseases|Fetal hemoglobin quantitative trait locus 1|Hb SS disease|Susceptibility to malaria|Heinz body anemia|Beta-thalassemia, dominant inclusion body type|beta Thalassemia","Conflicting interpretations of pathogenicity(Last reviewed: Jun 30, 2021)","criteria provided, conflicting interpretations","VCV000015333","11","5248232","11","5227002",15333,"30372","rs334","NC_000011.10:5227001:T:A"
"NM_000260.4(MYO7A):c.635G>A (p.Arg212His)","MYO7A","R212H, R201H","Deafness, autosomal recessive 2|Usher syndrome type 1|Rare genetic deafness|not provided|Usher syndrome, type 1B|Retinal dystrophy","Pathogenic/Likely pathogenic(Last reviewed: Jun 16, 2019)","criteria provided, multiple submitters, no conflicts","VCV000011850","11","76867950","11","77156904",11850,"26889","rs28934610","NC_000011.10:77156903:G:A"
"NM_000207.3(INS):c.266G>A (p.Arg89His)","INS|INS-IGF2","R89H","not provided|Hyperproinsulinemia","Pathogenic(Last reviewed: Jan 1, 2020)","criteria provided, single submitter","VCV000013380","11","2181149","11","2159919",13380,"28419","rs28933985","NC_000011.10:2159918:C:T"
"NM_000207.3(INS):c.266G>T (p.Arg89Leu)","INS-IGF2|INS","R89L","Hyperproinsulinemia","Pathogenic(Last reviewed: Jun 1, 1992)","no assertion criteria provided","VCV000013382","11","2181149","11","2159919",13382,"28421","rs28933985","NC_000011.10:2159918:C:A"
"NM_000207.3(INS):c.266G>C (p.Arg89Pro)","INS|INS-IGF2","R89P","Hyperproinsulinemia","Pathogenic(Last reviewed: May 1, 1997)","no assertion criteria provided","VCV000013383","11","2181149","11","2159919",13383,"28422","rs28933985","NC_000011.10:2159918:C:G"
"NM_005343.4(HRAS):c.181C>A (p.Gln61Lys)","HRAS|LRRC56","Q61K","not provided|Noonan syndrome 3|Lip and oral cavity carcinoma|Spermatocytic seminoma|Breast neoplasm|Thyroid cancer, nonmedullary, 2","Pathogenic/Likely pathogenic(Last reviewed: Aug 16, 2018)","criteria provided, multiple submitters, no conflicts","VCV000012601","11","533875","11","533875",12601,"27640","rs28933406","NC_000011.10:533874:G:T"
"NM_000256.3(MYBPC3):c.2992C>G (p.Gln998Glu)","MYBPC3","Q998E","Primary familial hypertrophic cardiomyopathy|Primary dilated cardiomyopathy|Cardiovascular phenotype|not provided|Cardiomyopathy|Left ventricular noncompaction 10|Primary dilated cardiomyopathy|Cardiomyopathy|Hypertrophic cardiomyopathy|none provided|Familial hypertrophic cardiomyopathy 4|not specified","Benign/Likely benign(Last reviewed: Dec 4, 2020)","criteria provided, multiple submitters, no conflicts","VCV000036610","11","47355475","11","47333924",36610,"45272","rs11570112","NC_000011.10:47333923:G:C"
"NM_000039.2(APOA1):c.341T>C (p.Leu114Pro)","APOA1|APOA1-AS","L90P, L114P, L5P","Amyloidosis, cardiac and cutaneous","Pathogenic(Last reviewed: Jan 1, 1999)","no assertion criteria provided","VCV000017931","11","116706987","11","116836271",17931,"32970","rs28931575","NC_000011.10:116836270:A:G"
"NM_001814.6(CTSC):c.1235A>G (p.Tyr412Cys)","CTSC","Y412C","Periodontitis, aggressive, 1","Pathogenic(Last reviewed: Mar 1, 2004)","no assertion criteria provided","VCV000007300","11","88027331","11","88294163",7300,"22339","rs28937571","NC_000011.10:88294162:T:C"
"NM_003356.4(UCP3):c.208C>T (p.Arg70Trp)","UCP3","R70W","Obesity, severe, and type II diabetes","Pathogenic(Last reviewed: Sep 2, 2008)","no assertion criteria provided","VCV000007579","11","73717343","11","74006298",7579,"22618","rs17848368","NC_000011.10:74006297:G:A"
"NM_000372.5(TYR):c.1205G>A (p.Arg402Gln)","TYR","R402Q","not provided|Oculocutaneous albinism type 1B|Skin/hair/eye pigmentation, variation in, 3|Cutaneous malignant melanoma 8|Skin/hair/eye pigmentation 3, blue/green eyes|Tyrosinase-negative oculocutaneous albinism|Autosomal recessive ocular albinism|Albinism|Foveal hypoplasia|Abnormality of metabolism/homeostasis|Choroidal neovascularization|Slow decrease in visual acuity|Elevated hepatic transaminases|Oculocutaneous albinism type 1, temperature sensitive|not specified|Malignant tumor of breast|Oculocutaneous albinism","Conflicting interpretations of pathogenicity, other(Last reviewed: Nov 26, 2020)","criteria provided, conflicting interpretations","VCV000003779","11","89017961","11","89284793",3779,"18818","rs1126809","NC_000011.10:89284792:G:A"
"NM_000352.6(ABCC8):c.4477C>T (p.Arg1493Trp)","ABCC8","R1494W, R1493W, R1515W, R1492W","Hyperinsulinemic hypoglycemia, familial, 1|not provided","Pathogenic/Likely pathogenic(Last reviewed: Oct 13, 2020)","criteria provided, multiple submitters, no conflicts","VCV000009096","11","17415881","11","17394334",9096,"24135","rs28936371","NC_000011.10:17394333:G:A"
"NM_005343.4(HRAS):c.181C>G (p.Gln61Glu)","HRAS|LRRC56","Q61E","Neoplasm of the large intestine|Transitional cell carcinoma of the bladder|Lung adenocarcinoma|Chronic lymphocytic leukemia|Hepatocellular carcinoma|Squamous cell lung carcinoma|Malignant neoplasm of body of uterus|Neoplasm of the thyroid gland|Malignant melanoma of skin|Adenocarcinoma of stomach|Acute myeloid leukemia|Pancreatic adenocarcinoma|Multiple myeloma","Likely pathogenic(Last reviewed: May 31, 2016)","no assertion criteria provided","VCV000376444","11","533875","11","533875",376444,"363323","rs28933406","NC_000011.10:533874:G:C"
"NM_000256.3(MYBPC3):c.2992C>T (p.Gln998Ter)","MYBPC3","Q998*","not provided|Hypertrophic cardiomyopathy","Pathogenic(Last reviewed: Feb 19, 2020)","criteria provided, multiple submitters, no conflicts","VCV000180993","11","47355475","11","47333924",180993,"179222","rs11570112","NC_000011.10:47333923:G:A"
"NM_004588.5(SCN2B):c.82C>T (p.Arg28Trp)","SCN2B","R28W","not provided|Atrial fibrillation, familial, 14","Uncertain significance(Last reviewed: Feb 6, 2017)","criteria provided, single submitter","VCV000060769","11","118039455","11","118168740",60769,"75311","rs17121819","NC_000011.10:118168739:G:A"
"NM_000518.5(HBB):c.*132+101G>C","HBB|LOC107133510|LOC110006319","","not provided|not specified|beta Thalassemia","Benign(Last reviewed: Nov 25, 2020)","criteria provided, multiple submitters, no conflicts","VCV000256341","11","5246595","11","5225365",256341,"254202","rs12788013","NC_000011.10:5225364:C:G"
"NM_000217.3(KCNA1):c.731C>A (p.Pro244His)","KCNA1","P244H","Myokymia 1","Pathogenic(Last reviewed: Oct 1, 2000)","no assertion criteria provided","VCV000013490","12","5021275","12","4912109",13490,"28529","rs28933382","NC_000012.12:4912108:C:A"
"NM_000545.6(HNF1A):c.1720G>A (p.Gly574Ser)","HNF1A","G574S","not specified|not provided|Maturity-onset diabetes of the young, type 3","Benign(Last reviewed: Nov 30, 2020)","criteria provided, multiple submitters, no conflicts","VCV000014939","12","121437382","12","120999579",14939,"29978","rs1169305","NC_000012.12:120999578:A:A"
"NM_001065.4(TNFRSF1A):c.362G>C (p.Arg121Pro)","TNFRSF1A","R92P, R121P, R13P","TNF receptor-associated periodic fever syndrome (TRAPS)","Pathogenic(Last reviewed: Jan 1, 2001)","no assertion criteria provided","VCV000012341","12","6442643","12","6333477",12341,"27380","rs4149584","NC_000012.12:6333476:C:G"
"NM_000545.8(HNF1A):c.1720A>G (p.Ser574Gly)","HNF1A","S581G, S574G","not provided|not specified|Maturity-onset diabetes of the young, type 3","Benign(Last reviewed: Dec 8, 2020)","criteria provided, multiple submitters, no conflicts","VCV000036810","12","121437382","12","120999579",36810,"45471","rs1169305","NC_000012.12:120999578:A:G"
"NM_020638.3(FGF23):c.535C>T (p.Arg179Trp)","FGF23","R179W","not provided|Autosomal dominant hypophosphatemic rickets","Likely pathogenic(Last reviewed: Nov 20, 2015)","criteria provided, single submitter","VCV000005026","12","4479730","12","4370564",5026,"20065","rs28937882","NC_000012.12:4370563:G:A"
"NM_000017.4(ACADS):c.511C>T (p.Arg171Trp)","ACADS","R171W","not provided|Deficiency of butyryl-CoA dehydrogenase","Conflicting interpretations of pathogenicity(Last reviewed: Aug 24, 2020)","criteria provided, conflicting interpretations","VCV000003830","12","121175678","12","120737875",3830,"18869","rs1800556","NC_000012.12:120737874:C:T"
"NM_000277.3(PAH):c.754C>T (p.Arg252Trp)","PAH","R252W","not provided|Phenylketonuria","Pathogenic(Last reviewed: Aug 13, 2018)","reviewed by expert panel","VCV000000584","12","103246681","12","102852903",584,"15623","rs5030847","NC_000012.12:102852902:G:A"
"NM_000277.3(PAH):c.1066-11G>A","PAH","","Phenylketonuria|not provided","Pathogenic(Last reviewed: Oct 1, 2018)","reviewed by expert panel","VCV000000607","12","103237568","12","102843790",607,"15646","rs5030855","NC_000012.12:102843789:C:T"
"NM_000277.3(PAH):c.143T>C (p.Leu48Ser)","PAH","L48S","not provided|Phenylketonuria","Pathogenic(Last reviewed: Apr 8, 2019)","reviewed by expert panel","VCV000000608","12","103306594","12","102912816",608,"15647","rs5030841","NC_000012.12:102912815:A:G"
"NM_000277.3(PAH):c.1222C>T (p.Arg408Trp)","PAH","R408W","not provided|Phenylketonuria","Pathogenic(Last reviewed: Aug 6, 2018)","reviewed by expert panel","VCV000000577","12","103234271","12","102840493",577,"15616","rs5030858","NC_000012.12:102840492:G:A"
"NM_000277.3(PAH):c.754C>G (p.Arg252Gly)","PAH","R252G","not provided|Phenylketonuria","Pathogenic(Last reviewed: Dec 8, 2018)","reviewed by expert panel","VCV000102823","12","103246681","12","102852903",102823,"108559","rs5030847","NC_000012.12:102852902:G:C"
"NM_001065.4(TNFRSF1A):c.362G>A (p.Arg121Gln)","TNFRSF1A","R121Q, R13Q","TNF receptor-associated periodic fever syndrome (TRAPS)|Multiple sclerosis, susceptibility to, 5|not specified|none provided|TNF receptor-associated periodic fever syndrome (TRAPS)|not provided","Conflicting interpretations of pathogenicity(Last reviewed: Dec 2, 2020)","criteria provided, conflicting interpretations","VCV000217017","12","6442643","12","6333477",217017,"213624","rs4149584","NC_000012.12:6333476:C:T"
"NM_000059.4(BRCA2):c.9117G>A (p.Pro3039=)","BRCA2","","Breast-ovarian cancer, familial 2|Malignant tumor of prostate|Medulloblastoma|Glioma susceptibility 3|Fanconi anemia, complementation group D1|Pancreatic cancer 2|Wilms tumor 1|Tracheoesophageal fistula|Familial cancer of breast|not provided|Breast-ovarian cancer, familial 2|Hereditary breast and ovarian cancer syndrome|Hereditary breast and ovarian cancer syndrome|Breast-ovarian cancer, familial 2|Hereditary cancer-predisposing syndrome|Breast-ovarian cancer, familial 2|Malignant tumor of prostate|Medulloblastoma|Glioma susceptibility 3|Fanconi anemia, complementation group D1|Pancreatic cancer 2|Wilms tumor 1|Familial cancer of breast|Breast-ovarian cancer, familial 1","Pathogenic(Last reviewed: Nov 6, 2020)","criteria provided, multiple submitters, no conflicts","VCV000038215","13","32954050","13","32379913",38215,"46771","rs28897756","NC_000013.11:32379912:G:A"
"NM_000059.3(BRCA2):c.9117G>C (p.Pro3039=)","BRCA2","","not specified","Uncertain significance(Last reviewed: Sep 11, 2017)","criteria provided, single submitter","VCV000632708","13","32954050","13","32379913",632708,"621449","rs28897756","NC_000013.11:32379912:G:C"
"NM_000059.3(BRCA2):c.9117G>T (p.Pro3039=)","BRCA2","","Hereditary breast and ovarian cancer syndrome|Breast-ovarian cancer, familial 2|not specified","Conflicting interpretations of pathogenicity(Last reviewed: Feb 27, 2021)","criteria provided, conflicting interpretations","VCV000267715","13","32954050","13","32379913",267715,"262852","rs28897756","NC_000013.11:32379912:G:T"
"NM_000257.4(MYH7):c.5533C>T (p.Arg1845Trp)","MYH7","R1845W","not provided|Hypertrophic cardiomyopathy|Cardiomyopathy|MYH7-related late-onset scapuloperoneal muscular dystrophy|Myosin storage myopathy","Conflicting interpretations of pathogenicity(Last reviewed: Jun 1, 2021)","criteria provided, conflicting interpretations","VCV000014114","14","23884230","14","23415021",14114,"29153","rs28933098","NC_000014.9:23415020:G:A"
